R,2023-01-24T17:45:04Z,Great film. Watching second time now. Lucky You are.,0
freddixon,2023-01-23T00:46:15Z,"Did they make it to the Santa Monica pier, that is the end of the route 66?",0
Adam Bolitho,2023-01-20T02:33:11Z,Is there a reason they aren’t wearing helmets?,0
Triple B,2023-01-07T17:07:53Z,It takes 11 days to complete the great American bike race from coast to coast. At least you guys had a good vacation.,0
Andrew Tice,2022-11-28T20:10:07Z,No helmets,0
joseph Schlichting,2022-10-13T04:02:59Z,This film is beyond amazing!! Thank you for making it!!!!,0
Krob777,2022-08-15T23:59:06Z,First dude quit his job to become jobless professional! How did he afford the trip?,0
Deborah Kocourek,2022-08-14T08:22:54Z,Of course the people from Illinois always want to talk about jeebus,0
J H,2022-08-07T20:55:13Z,no helmets? that`s dumb! otherwise great movie,0
Jesus,2022-04-11T23:22:27Z,I think it only got hard once hitting New Mexico and Arizona was cuz of the altitude and if you’re not in top top shape or used to it then you’ll struggle,0
Summer Kim,2022-04-08T14:36:33Z,What the fantastic 4!!! AMAZING,0
Shane Williams,2022-01-25T11:29:33Z,"Two years on, what a great watch. Amazing achievement.👏👏👏",0
backtoids,2022-01-21T12:50:17Z,americans like to talk,0
Tom Williamson,2022-01-16T22:06:22Z,Pat Drapac was a hitter in Melbourne crit scene back in the day,0
Nich Steele,2022-01-16T13:32:51Z,I love the description of the US.""A country at the crossroads of history"",0
KW,2021-12-31T05:39:49Z,Just don't understand the not wearing helmets,0
Keith Edginton,2021-12-29T22:07:30Z,An unwatchable video.,0
Gravel Pack,2021-11-27T20:34:32Z,Late to the party but love this film so good thanks for inspiring people to get out there.,0
Nathan Eide,2021-11-22T19:19:18Z,The dude in the house in St. Clair complaining about the racists was everything to me. One of the good ones. Thank you.,0
Robert Botta,2021-11-07T14:00:25Z,Great flick. I mean so damn good. Many many thanks!,0
Rick Bennett ART MUSIC VIDEO,2021-11-03T02:43:42Z,"Great film, but riding on US highways at night with NO helmet????",0
Wesley Matthee,2021-10-29T13:59:47Z,"@49:07 Yeeeehaaaa, eating a 2kg steak and carbs is how you fuel up for a 120mil ride.",0
Niall Wildwoode,2021-10-13T03:30:51Z,"Dusting off my bikes now, after hanging them up 10 years ago. I just wanna ride again. What an epic, beautifully created film. Those guys and lasses remind me of what it was to be young.",0
Rice Crash,2021-10-09T23:21:14Z,"As an Australian, when talking to Americans just nod in polite agreement.  If you can get past the wacky ideologies you will probably meet a nice person.",0
Melker Forssén,2021-10-09T09:52:03Z,That’s a rock band on bikes.,1
Oscar,2021-09-24T12:19:02Z,"Hey, beautiful film & great shots! I was wondering what camera did you use on the road? (which is enough compact & light to travel with)",0
Louis S,2021-09-22T01:39:20Z,"amazing riding, amazing music. but damn, Americans exude a desperate energy, don't they?",0
성두현,2021-06-03T12:22:52Z,멋지다!!!!!,1
Zafira dos Santos,2021-05-31T04:54:33Z,36:15 I will be the first to mark Uruguay on the map ;),0
Alejandro Salazar J.,2021-03-10T07:17:55Z,"The guys rode Specialized bikes, but what was Sami's bike? The paint job reminded me of a classic Cinelli I used to own. Wonderful film.",1
P1les956,2021-02-14T22:00:15Z,Absolutely ace! ❤️🏁🚴‍♂️,0
Thomas Q.,2021-02-04T20:52:46Z,"Thanks for putting the soundtrack in the description, just what I was looking for!",0
Irish Enchilada,2021-01-31T02:29:59Z,Hella dig the Standert!,0
Daniel Linck,2021-01-24T23:59:44Z,Iconic Vess Soda Bottle and Cherokee Street in St. Louis!  YES!,0
Roam Not Alone,2021-01-17T05:21:25Z,"To be honest, as a Filipino, I find this video... problematic.I commend those behind this video for having exposed the coded racism they encountered while cycling through the American heartland during Donald Trump's fascist reign. They could have just edited that out to create a feel-good video.But then again, the locals they encountered wouldn't have confided with those xenophobic and racist coded comments if the cyclists weren't white.The cyclists refrained from commenting when the locals spoke with xenophobic and racist coded comments and avoided confrontation. This is understandable, with them just passing through. But also perhaps they were neutral and ambivalent. With their silence, we are left wondering, suspecting. One thing is clear, a person of color such as I would not have that same luxury or privilege of being confided to or keeping silent about it.As a Filipino, I can't help but wonder, would those same xenophobes and racists be as honest or as welcoming if the cyclists were people of color such as I? Would they pretend to be nice or be openly hostile to cyclists and a camera crew with people of color?Is it too much to ask for people to counter racism and xenophobia whenever it rears its ugly head, however inconvenient? Is silence consent?What would I do if I myself was confronted with the same racism and xenophobia, however coded and oblique, on my cycling adventures abroad?",2
Mick Byrne,2021-01-04T14:10:13Z,Love this film... Cycling dreams!!!,0
Samuel Boustani,2020-12-25T22:46:27Z,What’s up with the helmets?!,0
Cycling Around,2020-12-24T11:38:18Z,Really inspiring trip folks! Love it!,0
Richard*,2020-12-22T10:33:22Z,awesommmmmmeeeee.....!!!!!! luv the music score...worked in so well with the film....,0
Christopher Kupi,2020-12-21T03:53:29Z,"It sure looked fully supported to me.  I think every cyclist can agree we would all love a fully supported and sponsored ride across route 66.  Probably an experence of a life time, Chapeau",0
Liam Walters,2020-12-12T18:02:57Z,These Outskirts movies are awesome! Can anyone recommend any similar?,0
ombra306,2020-12-12T01:08:37Z,"Sooo, we here so Australians can have their own planet?....?",1
Kevin P,2020-11-28T07:05:32Z,This is probably the coolest movie on the interwebs. You don’t even have to be a cyclist to see the coolness. Bravo!,1
Pat Premdas,2020-11-27T08:05:53Z,"Words like ""organic"" and maybe natural, best describe this film.  I loved the challenges and various obstacles.",1
david duffy,2020-11-25T13:33:46Z,"Great film, it looked like a really wonderful experience thanks guys. I feel inspired.",0
Billy,2020-11-25T00:51:57Z,I love this but: who carried all their gear?,0
Cyclo Mordino,2020-10-20T17:35:47Z,No helmets from the beginning till the end... Strange cyclist mentality...,0
Rodrigo Escobar,2020-10-20T16:14:30Z,Watching the hospitality extended to them by Americans in 2020 is unbelievable.,0
Adelina Barrow,2020-10-11T14:15:47Z,I needed to watch it for school and i don't regret doing my homeworks for once !It was great😌,0
Carter Newcomb,2020-09-08T00:36:56Z,20:40 Currently cycling the route. Passed by here a few days ago. The ""E"" has fallen down since they filmed this.,3
PurpleDuckHemp LIVES Life,2020-09-07T12:17:10Z,LOL Hipster BikePacking.    (hotels every night),0
Adam Castro,2020-09-06T07:02:04Z,"Feeling so inspired . Although I’m a little bummed that there was no footage of y’all riding through flagstaff, it’s my favorite place on rt66",0
climbslc,2020-08-10T01:16:15Z,"Loved the video and feel connected to you all. You met some incredible (and bizarre!) people. But yah, winds in the US go west to east :)",0
Sportbike Jesus,2020-08-02T07:13:13Z,12:30ish imagine living to 80 years or so and still believing in spirits and demons 🙄,2
oosung,2020-08-01T20:48:16Z,very inspirational... what happens to the threat of snow?  such suspense... makes me want to ride.,0
salvatore mannino,2020-07-30T07:18:45Z,"Starting on a wrong note out of the gate. R66 is certainly one of the most iconic routes in the world, but ""The most iconic""? Nah... but I am not surprised since this a Rapha ad and they tend to overstate anything they do. Always better, bigger,  more exclusive, add the bullshit to that too. They invented cycling after all didn't they?",0
Matthew Carter,2020-07-14T07:37:25Z,So I suppose this should be asked did you see any clones firing on Jedi?,0
StefanoM68,2020-07-06T10:32:03Z,What about music list ?,0
Juan Keller,2020-06-29T02:31:17Z,No helmets?!?! Not cool,0
Saifulbahri Hassan,2020-06-28T04:08:15Z,Now I need to plan for that multi-day ride. Can’t get it out of my mind.,0
Gasman1440 A.,2020-06-22T02:32:57Z,Gus and Lachlan and their crew are saving biking.,0
SchmeddyBallz,2020-06-18T18:53:36Z,So let me get this straight. Rapha and a bunch of other brands paid a bunch of good looking hipsters with little to some professional riding experience to ride across the country and get drunk every night?,1
Michel Modique,2020-06-14T16:16:03Z,https://youtu.be/fEv-Ne7XZyE,0
Sundance Kidd,2020-06-09T20:45:53Z,Awesome journey.,0
matthew kalb,2020-06-08T02:07:56Z,"everyone yall interviewed is why i do NOT go over to those parts of the country anymore. Been there, Hate it, hate them, hate all of it. IDK what planet they live on, but what ever planet is it, they watch WAY TOO MUCH TELEVISION THERE and they DEFINITELY don't travel international EVER/ENOUGH. There's a GOOD reason people call that shit ""Fly Over Country"".",1
CHW BIKER,2020-06-05T15:26:38Z,"Awesome movie! Outstanding edition, soundtrack and everything! Very entertaining! Wha t great adventure! Well done guys! Can’t wait to watch the outskirts 2 and 3!!! Big hug from Brazil!",0
gfsdgfabfsdafjsavbdfs,2020-06-04T09:56:00Z,Something about this film makes me want to shoot snot rockets at cyclist wearing Rapha.,0
The Crankster,2020-06-02T22:21:26Z,"Awesome videos, but pls wear your helmets,,, also Harley the guitar guy could play for a rock band.......",1
All4Outdoor,2020-06-01T22:53:20Z,In summary: Idiot Americans talking shit and stupid cyclists with no helmets and no jobs.,0
RubiconResolve,2020-05-29T21:24:08Z,What an amazing adventure! I love the southwest but it's not for the faint of heart.,1
Ron Harper,2020-05-29T03:38:43Z,"Far out but I always did West to East Trani Rides with much more Tailwind, well except in Kansas Dorothy lol",0
Lin4rd,2020-05-27T11:37:46Z,""im anti drug but pro marijuana... by the way I love Trump and we need a new planet for different diversities"" that guy was crazy hahaha..,2
James Portoraro,2020-05-25T19:14:37Z,I heard Sean Nicholas Savage at 39:35! Whaaaaat!,0
munnis,2020-05-25T15:02:13Z,""A different planet for the Australians... different planets for different diversities. That's the long term goal"". You sir are on another planet.,44
Gabriel Schneider,2020-05-24T15:19:07Z,Hipster Shiaaat,0
Walter Manhead,2020-05-23T19:34:13Z,"Man, fuck these pretentious self-loving assholes... unwatchable shit. YUK!",0
Ulysse,2020-05-23T07:31:03Z,"I'm 15 minutes into the video, already heard 2 people believing in God and other 2 believing in Trump. That's uncomfortble.",8
TheDukes Adventures,2020-05-23T00:57:43Z,Epic & inspirational    .... well done and thanks 👍🏻,1
Willie Richards,2020-05-21T16:16:57Z,Freaken Epic!!! 10 out of 10,2
Felix Hickman,2020-05-21T13:54:50Z,Your mate died in a cycle accident so you decide to cycle route 66 with no helmets?... great example,12
Aurboða Khattak,2020-05-21T10:27:14Z,43:08 what the fuck,0
Chris Joynson,2020-05-20T10:48:48Z,A bit to 'hipster' for me. Don't see much of the actual landmarks of Route66,0
Danie Febry Arieffian,2020-05-20T04:41:41Z,Amazing,0
David Cornelison,2020-05-18T02:36:58Z,Outstanding!,0
Justin Avo Sane's Da Came After Human Revoutions,2020-05-16T01:33:57Z,alright revise write screen name,0
DP Mercado,2020-05-12T18:15:16Z,Enjoying the film...started with 2...I am dissappointed that for this film you had an idea of Sami's knees already and you still got her for 2! Hope she is not on 3 anymore.,0
Alex Buck,2020-05-11T06:27:58Z,No helmets? Cool vibes anyway 😀,1
吴桐,2020-05-10T09:49:55Z,有头盔却经常不带？这很糟糕。,0
Kris Vladimirov,2020-05-08T14:06:24Z,"39:43 - seriously fast traffic roads... no helmets? Why? This is stupid, especially for those that look up to Rapha or these riders as influence.",7
Good Morning,2020-05-06T23:09:06Z,"this is super entertaining...how does it not have more views? Love these riders, it's nice to see ultra-super riders as kind of normal human beings (kinda, they still amazing)",0
Kris Vladimirov,2020-05-06T14:42:00Z,Why are there significant stretches where they're not even wearing a helmet? Especially after one of them mentions a death at 29:00.,11
Richard Brabbs,2020-05-03T10:16:08Z,The vet with the tattoos was so cool you get how friendly most Americans are by watching stuff like this,0
Edu Artico,2020-05-02T08:03:29Z,"El sueño de los elegidos....sois para mi, una belleza inspiradora...lo agonico se mezcla con la musica en un caracter de talento y belleza en su poderosa frecuencia",0
Rob K,2020-04-30T00:34:45Z,"There are a lot of really lonely people on the road.  People who need to tell their story, And no one to take the time and listen.",3
Byron C,2020-04-29T11:51:46Z,Let's Play the Outskirts/Thereabouts Drinking/Bingo game. This can be played across any of the Gus Morton films. 1 shot per occurrence 1. Every time Gus talks about his hang up with pro cycling2. Sami gets injured3. Sami talks about wanting to be a pro cyclist but then decides not to become one4. Unknown former pro cyclist joins trip and talks about personal hang up (s)5. Some kind of routing drama leading to fake suspenseful moments of trouble (despite support car and crew) ensues6. Vandalised helmets7. No helmets8. Bike mechanical9. Shot or scene were local encountered populace are made out to be stupid/backward/dumb/tribal with the caveat of friendliness etc10. Weird eating or drinking situation 11. Something about Australia even when it's so out of context,2
Rob Thompson,2020-04-28T08:06:12Z,"Fun film. Honest question, though - what’s up with riding without a helmet? I feel naked without mine (and at least 3 have saved my noggin over the years). You do you, I’m just confused why anyone would risk a TBI. It’s not like they are heavy or uncomfortable. What gives?",46
bmtg01,2020-04-27T09:36:53Z,Congrats on a massive effort. Those roads look boring as hell though.,0
P R little B,2020-04-26T17:03:59Z,Why aren't they carrying any gears?,0
SchreinTime,2020-04-25T21:35:50Z,Bunch of dumb dumb salads,1
theos man,2020-04-25T13:18:22Z,Waste of time to watch this vídeo 👎,0
Fei Xia,2020-04-25T08:00:11Z,wear helmet guys,12
AVilla32,2020-04-24T15:14:41Z,Amazing Film! Really inspiring and makes me want to do a bike adventure,1
Evan B,2020-04-24T03:34:42Z,Absolutely love the ethos and self progression! Why ditch the helmets on busy highways? Seems counterintuitive,8
yung meise,2020-04-22T19:11:31Z,Awesome flick!,0
Jani Rapo,2020-04-20T23:24:38Z,Epic.,0
Jonesy 349,2020-04-19T16:29:35Z,2020 still awesome,0
Sebastian Logue,2020-04-18T14:31:19Z,what camera setup was most of this filmed on?  I'd imagine it would have to be somewhat compact?,0
The Hanoi Beat,2020-04-18T14:17:39Z,"Very nice, very nice!",0
YAEGER1990,2020-04-17T13:57:29Z,"This is a great film!!! Awesome work to the riders, staff, and all the support people!",0
Patricio Pajuelo,2020-04-17T03:41:53Z,Beautiful stuff. Sublime and  Inspiring !,0
Unknown Unknown,2020-04-16T16:27:53Z,Good film but could you find riders that are anymore hipster good gosh. Some of them loom like they need to be held under water.,0
DopeDo,2020-04-16T01:15:08Z,She's the only one who had the huevos to ask for a ride,26
Miguel Aroso,2020-04-15T21:44:47Z,"Great adventure, just loved it guys. Cheers. :)",0
Arthur J,2020-04-13T13:11:09Z,No helmets. Dislike.,1
Alan Arrieta,2020-04-13T04:31:38Z,Traducir al español,0
Paul Brackett,2020-04-09T09:40:09Z,11:19 it had everything you could imagine on it. it had truckstops... hahhahahaha,5
Jolene the Llama,2020-04-09T01:13:26Z,"Dear lord, the US is FILLED with people who feel they should and need to come up to you unprovoked and tell you all their believes and their life stories.",2
Wheelers At Large,2020-04-08T07:40:49Z,The best t-shirt ride ever👍,0
Bj Scoular,2020-04-08T07:13:44Z,"Watching this during COVID -19 in 2020 and loving it, wanting to get on the bike and explore right now!",51
Facu Hale,2020-04-08T05:13:27Z,"Hipsters on bicycles, I think that in the entire documentary they must have ridden the bike twice as much",1
SDE,2020-04-07T13:47:46Z,Boom👍🏻💪🏻,0
markmacklin1,2020-04-06T19:25:04Z,"Now, granted I'm only 5 minutes in - but these guys seem like boneheads. Forgetting the crankset and BB? Why do you even need to remove those items for shipping a bike? Then the guy overinflates a tubeless tire onto an ENVE carbon rim. I mean, what did you think was going to happen? Then a guy who knows he's lactose intolerant or whatever willingly consumes a Snickers bar? I mean, WTF - its milk chocolate. I'm sure this is not a new condition - how do you not know you can't eat a fucking Snickers bar?!?I hope it gets better for them as this thing goes along - and that they somehow get much smarter as they travel much, much further.",1
George Vargas,2020-04-06T05:52:18Z,Awesome! and I love the parts when you weren't wearing helmets and just riding your bikes!,3
Travelling Man,2020-04-05T21:31:54Z,This is why I never had an urge to cycle Route 66.Oh...all my kliometers added up is about 3times around the world !!!,0
sneezer,2020-04-05T14:12:25Z,15:07 ""Our long term goal is to ship Australians off to another planet."" 😆,33
Timothy Inman,2020-04-05T03:35:09Z,I didnt think parts of the 66 still were passable anymore,0
TimpanoDeAcero,2020-04-04T19:00:48Z,Why don't they wear helmets at some moments?,2
James McGarragle,2020-04-03T23:38:28Z,"No matter how far you cycle, you're never far from a racist in America",5
Fernando Amurri,2020-04-03T03:47:52Z,"muy buen documental, excelente música e imágenes, pero usen cascos la próxima vez.",0
Günter L.,2020-04-02T11:37:47Z,"Really great and beautiful movie, but not wearing helmets and sitting directly beside the highway while repairing a puncture is so unbelievable stupid and totally unnecessary. So it is not possible for me to give a thumb up.",0
matthew kalb,2020-04-01T03:31:31Z,the reasons that the world hates the US is because the government takes advantage of the populations good nature. I've hitchhiked all over the world and I never had a problem in the states,0
Bosse Brand,2020-03-29T18:18:30Z,missing a crazy lad or another aussie wearing nothing but pit vipers on his specialized tall bike in this movie though,0
conneeps,2020-03-29T06:28:04Z,Love how in all of these videos Gus with his cardboard personality tries to get all deep with the locals....”so what’s it like growing up here?” I’d love to see these videos redone with at least one rider with charisma.  Does Sami get hurt in all of these or only the ones I watch?,2
Matthi S,2020-03-28T09:18:44Z,"Be smarter than these guys, wear your helmet",4
Massproduce201,2020-03-23T00:28:24Z,"Nice film really appreciate it!!! I am still one that prefers function over form when it comes to something as simple as cycling. Give me an alloy frame, tubes, and comfy clothing over everything else any day!!",0
Eric Palummieri,2020-03-21T01:40:10Z,Hi I’m 23 and just discovered that snickers bars are made with milk chocolate which makes my hipster tummy sad,2
J Munny,2020-03-16T04:48:59Z,Always wear your helmets kids!!,0
Jason Jackson,2020-02-28T02:33:41Z,"Really enjoyed this, very inspiring",0
rc g,2020-02-19T16:20:17Z,this genre of cycling content will age hilariously,1
Arthur Price,2020-02-04T10:17:16Z,"I like that Rapha has endorsed a film where cyclists aren't wearing helmets. Good message, solid!",0
Josh Hicks,2020-01-16T17:44:33Z,bessstttttt intro ever!,0
Dwayne Pedals ,2019-12-31T14:34:43Z,Such a great film. This brought back a lot of memories. Nice work as always Rapha and the folks who took on this route.,0
oils1976,2019-12-30T02:28:14Z,At 40:30 this whole film becomes eerily similar to this episode of Mighty Boosh.  https://www.youtube.com/watch?v=7mKlmzLkoxY,0
Nguyên Hồ,2019-12-26T10:26:28Z,"Rocking Blue Monday, can't go wrong",0
Ben Revel,2019-12-10T18:16:53Z,"Love the film, wish you guys were wearing helmets a bit more often though :oo",6
Itai Ashkenazi,2019-11-16T21:46:52Z,Hour and 20min of brian jonestown massacre.,0
Daniel Iordache,2019-10-31T14:43:10Z,"Loved all of this, the genuine experience, the raw emotion and connections with the people",1
ydnar,2019-10-24T22:06:13Z,This was so epic. Myself wanted to be on this ride with them. Great video and editing . The hardship is the lesson and reward.  Lotta Grit !,2
durianrider,2019-09-26T13:45:18Z,@8:45 lol. #govegan xD,11
Tom Holmstrom,2019-09-17T02:47:41Z,SO. MUCH. HIPSTER. Lol. But great film. Very inspiring.,4
Roch,2019-09-16T12:05:15Z,I only hit like when Gus finished the big Texan challenge,0
Kim Rice,2019-09-15T12:27:02Z,Love the Steel Stanton Steed!,4
Greg Stevenson,2019-09-13T21:42:17Z,This stuff just restored my faith in the internet.,0
B A H,2019-09-13T15:29:51Z,Rather wanky in places.,0
tubesockets120v,2019-09-12T15:33:03Z,Snickers satisfies and KO's 🥊.,1
Eddie,2019-09-12T05:18:37Z,"Not sure why you'd want to bike on the shoulder of a highway, but cool film regardless. Also, no helmets???",2
Sisyphostubes,2019-09-07T13:30:39Z,"Yeah, let‘s ride high profile carbon wheels and wear 250€ bib shorts ... but wait, we are looking too serious ... ok ... a stupid front rack on the bike and a jeans jacket looks cool and shows that we don’t care and of course no helmets and why don’t eat a snickers and vomit a little bit ... and finally ... best idea ever ... let’s forget the cranks ... ‘cause that’s the final proof that we are some hipster dudes who don’t give a * ... really? What a meaningless and vain documentary! But I like the great landscape and the nice score.",3
Paul Drouin,2019-08-22T00:32:48Z,Whaaaaaat! No helmets!!  Perfect Dudes and Dudeses ;-),2
elzumpango,2019-08-11T14:46:04Z,"Rapha, TAKE ALL MY MONEY",1
Pontus Stråhle,2019-07-22T09:36:59Z,"Oh, please can some one help me!  Is there's playlist - love the music!",8
ADAME【動画】,2019-07-10T11:19:14Z,Japanese sub please 🙏,0
Joe Ward,2019-07-01T13:51:19Z,"This is a bit of a horror show for Americans, but nothing that isn't true. Excellent film-making.",3
Levi Weeks,2019-06-28T19:13:30Z,Dang this was great.,0
Thibault Journet,2019-06-20T19:53:16Z,Public relations counselors are really good nowadays,0
J-Why ?,2019-05-04T19:15:40Z,"Loved the movie. Loved the idea behind the movie as well. Things that brings different people together can have such a positive force if people try to make it positive. You may not always like what you see and hear, but it is good to put yourself out there. Congrats on being able to complete this epic trip, 😁",0
Ed,2019-03-13T12:18:44Z,Ils ont croisé de sacrés beaufs didonc,0
Lorenz Siggel,2019-03-12T19:55:36Z,I can’t decide if I liked it or not.......,2
Foxr6,2019-02-25T00:49:13Z,Epic flim! Thank you!,0
M.622,2019-02-03T04:34:49Z,When did they leave in March?,0
uhurupeak2001,2019-01-31T22:56:04Z,i stopped buying this brand 5 years ago when they sponsored SKY team the mentality of this group suck. Since i ride with mavic and gore bike and bioracer better quality,0
Florian Friedrich,2019-01-23T15:55:10Z,Does someone know the specialized frame names? They are looking super dope,0
Ross Luo,2019-01-12T04:10:29Z,i like ride bike. i will be  riding bike across the u.s route 66.....,1
Andy Zephyr,2019-01-06T03:26:38Z,I'm waiting for the sequel. ""Death By Snickers"".,2
Trent,2019-01-02T12:16:39Z,"Fun film, but you need to go easy on the hand-held ""action"" footage.  Hard to watch sometimes due to the constant shakiness.",0
Kevin McCauley,2018-12-06T04:21:11Z,"Why so many creepy, old, white dudes?",3
margm4,2018-10-22T03:03:10Z,"Thanks Guys and gal. We’ve travelled the mother road by mustang, SUV etc. Absolutely love it like you guys did. The people, the beauty, the nostalgia. Thanks for taking me back😊 I’m 72 so no doubt won’t get back, but the memories will never leave me. Another pair of Aussies 😊🇦🇺",0
jay collins,2018-10-06T12:33:54Z,Fantastic Gus 🤘🏻,0
Thomas Shea,2018-09-23T04:07:28Z,Seriously! Long time RCC member. Love virtually all the videos. And then this. What happened? Why the drama boys? Here's a guy that I want to watch. https://www.youtube.com/watch?v=zyCAhT47pfQ,1
Christian Cummins,2018-09-19T04:22:16Z,Great film. Makes me want to ride.,1
C345 OFR,2018-09-10T23:30:56Z,"Would the hospitality on show have been the same had Duke Agyapong (from your 'Riding is the Answer series') gone along for the ride? I very highly doubt it. It was, at points, quite an uncomfortable watch.",3
Chris White,2018-09-08T08:30:56Z,"I'm surprised. Instead of being inspired, if I do any riding in the USA I shall be avoiding Route 66!",4
Brandon Scales,2018-09-03T04:12:00Z,Great film. Solid team for an amazing ride.,0
Andy H,2018-08-16T18:05:15Z,"Didn't enjoy this at all. Fractured, bitty, poorly edited and not to the usual Rapha standard. The continental films are so much better and, unlike this, actually make you want to ride. I think the personalities were weak as well and this didn't really help matters.",5
Kari Black,2018-08-15T17:24:03Z,What did you do at  Sitgreaves Pass in the Black Mountains?  Very dangerous area.,0
Steve Booth,2018-08-15T14:16:46Z,I don't understand why the one guy has cargo racks for no cargo?,1
Ben Lubin,2018-08-12T19:03:46Z,most of this ride looks boring AF,8
Blog Pedalare verso il cielo,2018-08-12T14:25:45Z,Noioso. Cowboy oppure ciclisti ? Poco Utile. Pedalare senza casco è un cattivo esempio. Da rifare.,0
dark-world,2018-08-11T11:13:29Z,Bit ""montagey"",0
0GreenHat0,2018-08-09T22:29:48Z,gone watching the first one,0
