Don Keller,2019-08-31T02:14:26Z,"A genuine story — ya can't fake a buckle earned at Leadville. And Howes & Mort going wide tire and pizza cog, T making eggs, talk of riots, a shotgun firing in a crowd, bottles leaking in the dirt, and pushing a bike coz it's faster?! This film is high. Literally. Thanks, Rapha, again, please.",0
Shawn Stradamus,2019-08-31T01:39:46Z,"""Do your best, then tell the story.""  - Tejay Van GarderenGreat stories!  Thanks for Sharing!",13
Frank Kottwitz,2019-08-31T01:13:40Z,Love these films it’s great that EF lets their riders do the rides and share them with the world!,2
Rick Jesse,2019-08-31T01:10:18Z,"Wow, beautiful video. Loved it. Thanks RF!",0
KushPizzaSleep,2019-08-31T00:36:24Z,Phinney is done as a world tour rider,1
Dean Johnson,2019-08-31T00:02:34Z,sweet! saw myself at 5:47 @ swag bag booth!   Great recap and interviews!  one of the best!,0
Me,2019-08-30T23:36:35Z,"""all of a sudden you realize how long of a day some of those people will have"", yeah, tell me about it.",3
Gordon Chaffin,2019-08-30T22:08:18Z,"Fantastic video. These race videos have turned me into huge fans of your team and riders. Thanks for racing Utah, also. That event needs support.",0
Josh Tipton,2019-08-30T21:48:54Z,"I saw the GBDuro video and thought 'this was easily your best video', but somehow this topped that.",0
Trail23dom,2019-08-30T21:27:50Z,"Someone count  how many times Lachlan said ,,like""",4
Marvin,2019-08-30T21:24:59Z,I can't get enough of this videos!!,0
Mike Billington,2019-08-30T21:14:57Z,"these films are so , so good. Its sports science / psychology  - full on study lesson material. thank you for giving them",0
Jack Swift,2019-08-30T19:42:20Z,Man Rapha's media team is fuckin awesome. These videos are so well done.,54
T. Jones,2019-08-30T19:39:58Z,So good! Keep them coming and keep doing what you're doing! The sport needs it,0
Stefan Kovac,2019-08-30T19:29:49Z,Crazy how Simmons(junior) outsprinted Lac and Pete,10
Bruce Little,2019-08-30T19:23:07Z,"Congratulate to :Town of Leadville - on a great come backAlex Howes - on a great US championship, you give new meaning to never quit attitude",1
GreyWolfClimber,2019-08-30T19:06:36Z,Great little town. Done that race several times in the late 90s before it got well known.,0
Kosmonooit,2019-08-30T18:49:31Z,Great production etc,0
ridesantacruz,2019-08-30T17:54:27Z,"Great production, Guys. Thank you.",0
Kim Wiltshire,2019-08-30T17:46:26Z,Will be interesting to see what they make of the forthcoming 3 Peaks. Loving the videos.,0
Chuck Lewis,2019-08-30T17:46:21Z,I hope that the riders are enjoying participating in the ""alternative calendar"" rides as much as we are enjoying watching the videos...,1
Fraser D,2019-08-30T17:45:38Z,That motivational speech... I'm sitting here pumped up!,2
tubesockets120v,2019-08-30T16:53:08Z,EF-  Coolest crew out there.  Whether they can crush a bronc or not.,0
Anthony Gittins,2019-08-30T16:52:23Z,Love watching the guys taking on these alternative cycling events!,0
Alexey Koshevoy,2019-08-30T16:11:47Z,But why do they raced in the road shoes and with road pedals?,0
NFTNOR,2019-08-30T16:09:13Z,Amazing!,0
W.C. J.,2019-08-30T15:10:14Z,"Man, the beginning of this was so dark (rightfully so) but I thought I had clicked a VICE video",11
X X,2019-08-30T14:52:37Z,"I could watch these videos forever. I love being able to see the personalities of the riders and the chilled run-through of the event with them. That's whats missing from the TdF, which is more stilted and distant a lot of the time. I love the UCI world tour, but there's something down to earth and levelling about the behind-the-scenes videos of these alternative events, love it",0
Scott Frisby,2019-08-30T14:11:27Z,What a great production!  Loved it and the three EF riders.  Such unique personalities!,0
Richard Young,2019-08-30T14:09:05Z,Inspiring video.... Thank you...,0
Eloy Anzola,2019-08-30T13:57:56Z,so much awesome!!,0
Flying Lap Productions,2019-08-30T13:34:48Z,Ugh... another pseudo intellect statist heard from 🙄,0
Jim Davenport,2019-08-30T13:27:36Z,"Rapha and Team EF, this is turning into one of the best video series out there. Love seeing these guys get out and connect to the biking community and document the experience. You've got a new fan here. Go Team EF!",9
Gravel Chef,2019-08-30T13:08:09Z,"This series of videos are so entertaining and inspiring.  Thanks to the riders, team, and sponsors!",0
T Wr,2019-08-30T12:26:26Z,Loving the EF gone racing... Great variety of the cycling spectrum covered. Good work even for roadies! ;),2
PinkBunnySlippers,2019-08-30T12:25:41Z,some of the best cycling videos on the web! love the off beat race videos so much so inspiring :),2
Colin Thompson,2019-08-30T12:25:05Z,"Such a cool team, loving how you mix it up, great for the sport 👍",0
Gaulois réfractaire en exil volontaire,2019-08-30T12:06:17Z,"EF1 is the coolest pro Team on all surfaces. For sure, they wear the best kit. Watching this video, it feels like cycling is their way of life, not a job, not a stepping stone to wealth and fame. Lolling forward to the next episode. Thank you Rapha!",0
lars_tri,2019-08-30T11:50:24Z,"Truely the best video so far!! Dang, this intro ! The speech at the briefing soo amazing. Goosebumps all over when the anthem was sung. Mindblowing steep sections on the course and all this amazing people around. Just epic! Thanks so much for this video Rapha & EF ! <3. I almost feel like i have to participate there aswell someday.",0
Kidtricky69,2019-08-30T11:33:17Z,Lachlan is awesome.....!,0
jim bouras,2019-08-30T11:28:34Z,The reason i love cycling in one video.Thank you guys....,0
gernst83,2019-08-30T11:15:13Z,Love this series!   -   EF needs to check out Marji Gesick  - https://marjigesick.com/,1
Patrick Smith,2019-08-30T11:04:37Z,Great video and a bucket list event for me.,0
Gardar S,2019-08-30T10:21:35Z,“Let’s start a riot” @10:00 minutes fits EF gang and the inspiration with their videos. Now it will be impossible to get into Leadville 100. Thanks guys!!!! 😀😂😉,1
Salinda Kumara,2019-08-30T09:23:13Z,999th LIKE Keep them coming EF no matter the grand tour any more to more of us with same $h%t18:09 me watching grand a tour be like,1
buddhahat,2019-08-30T09:16:22Z,"You guys are making some of the most powerful cycling videos out there, this stuff is just amazing and that pep talk made the heart rate flutter and bring up some emotion, it was really beautiful. Thanks to everyone who contributed to the making of this, it's truly inspiring.",0
George,2019-08-30T08:03:25Z,Theres something really special about these films. Loving it.,0
Target Pace,2019-08-30T07:57:59Z,Nice racing and superb production well done EF,0
L7KKE,2019-08-30T07:33:52Z,Another great video! Fantastic content and branding!,0
Gary Bird,2019-08-30T07:06:50Z,Man that pep talk would keep anyone going.,2
gamby16a,2019-08-30T06:44:39Z,"Lachlan is hilarious.  He's so chill and goofy, but he's a monster who has one speed: kill.  Really bummed Taylor couldn't make it.  He's Lachlan's American doppelganger 😄Phenomenal film, as usual.  Such a great series.",2
myminx,2019-08-30T06:27:53Z,"Love these videos , new fav’s team !",1
Lm Ao,2019-08-30T04:40:54Z,You know shit is fucked when you see Taylor Phinney without facial hair,0
EMC2Scotia,2019-08-30T03:59:42Z,So many great moments! What a year of footage this alternative program has created and captured.,0
Josh,2019-08-30T03:53:33Z,Great video!,0
Harris R.,2019-08-30T03:24:30Z,Inspiring vid!  You really can get high in Colorado.,0
Lee Hanyo,2019-08-30T03:24:12Z,Brilliant as always,0
J P,2019-08-30T02:53:43Z,Quinn Simons.,0
Will Rickards,2019-08-30T02:50:48Z,Anyone know what kind of handlebars Lachlan is running?,1
ADAME【動画】,2019-08-30T02:12:54Z,Japanese sub please🙏,0
Brian Messemer,2019-08-30T02:12:50Z,Now I'm remembering about how Lachlan did the ultra ride across the UK...that must give him such confidence in a race like this.,4
Dennis 4523,2019-08-30T01:59:44Z,Dude I’d love to be a part of the EF team But I’m only a junior :/,2
Chris Eyestone,2019-08-30T01:29:00Z,Lachlan - awesome reflection - what you are doing is not selfish at all. You have inspired me and many others. Keep on smiling,3
Rudi H,2019-08-30T00:54:50Z,Create playlist soundtrack for #EFGoneracing pls,0
Mike Sima,2019-08-30T00:39:53Z,Another great event .... You are all class acts and inspiring .... can't wait for more,0
Ivan Ivanov,2019-08-29T23:37:33Z,Loving the EF squad adventures,0
Brian Ferguson,2019-08-29T23:34:49Z,Love the races EF is doing.  Keep this up please I wish all the pro teams would do this it is great for cycling,0
Milz FD,2019-08-29T22:59:13Z,simply the best,0
Henry,2019-08-29T22:57:20Z,Best series on YouTube,0
Road Glide,2019-08-29T22:45:03Z,"Anyone who could thumbs down this has got absolutely no soul. Save your life, ride a bike. Just my .2. Peace.",0
Rudy Elizondo,2019-08-29T22:39:56Z,"Aw man, I’ve been waiting for this great video for a while, very cool and my new hero’s!!!",2
Rudy Elizondo,2019-08-29T22:38:56Z,"You guys are awesome!!! Leadville is also very hard like dirty Kansa , wow!!!",4
vannick,2019-08-29T22:38:51Z,Next up: EF does enduro,0
Thako Harris,2019-08-29T22:30:02Z,You know how to crush Bronc! LOL LOVE IT!,1
funk44,2019-08-29T22:22:27Z,These movies are absolutely fantastic,0
Nick Stevens,2019-08-29T21:59:29Z,Love this alternative race calendar and the personalities of these guys!,9
zero_trooper,2019-08-29T21:50:53Z,Great production values! Loved it!,1
Case Farley,2019-08-29T21:40:27Z,"Howes looks great in the USA jersey, and Morton has to be the most low-key savage on two wheels. I get a big kick out of these videos, and the 'alternative race' program (or whatever it's called). Nice work.",114
Richard T. Rogers,2019-08-29T21:21:01Z,I am so so so happy to see these videos. The production quality behind them.. the story telling... the people they showcase. I love it all. Thank you!,0
Shaun Thomas,2019-08-29T20:56:12Z,Alternative Schedule > Tour de France,29
Sam Cohen,2019-08-29T20:39:13Z,Epic and awesome!!!,0
jake,2019-08-29T20:02:39Z,Some people just can't resist... 15:40,2
lipsterman1,2019-08-29T19:55:24Z,What grading was that one climb? It had to be something crazy.,2
Stuart McGill,2019-08-29T19:50:25Z,"Yep, I'm loving your approach to cycling. Great work from the riders and the production team. Thanks ;-)",9
Kevin Loen,2019-08-29T19:29:54Z,Got a ""is this cat wearing road shoes"" moment when I saw one of the guys run with his bike. Bold choice indeed.,37
Werdna Liten,2019-08-29T19:29:14Z,"Another fabulous film - makes you want to get out on whatever bike you have, and have an adventure or explore!",3
Jon Rubel,2019-08-29T19:26:39Z,Another brilliant  video. Keep em coming. Can't wait to see  what's next! Can't they get more team members to  join in?,8
Alex Burge,2019-08-29T19:23:20Z,"Colour me inspired. I'm off to Colorado. Alex, Lachlan and Taylor, you have painted my 2020 and 2021 out. Thanks!",0
tony blunsum,2019-08-29T19:21:51Z,Awesome video guys great to see you’re so down to earth! Hope to see more of this stuff thanks for making it 😎,3
traderz13,2019-08-29T19:14:45Z,"Love these rapha films. Learning the back story of the race really adds to it. Bike riding changes lives.Well done rapha and EF for this alternative programme, hope its working out financially since I am enjoying watching it and so I hope it continues",148
SportsFan Tommy,2019-08-29T19:08:58Z,Great video! Loved the backstory and the commentary from the riders.  Howes jumping off the bike and going faster was the comedic highlight.,6
Francis Bombus,2019-08-29T19:07:23Z,Love it!,0
Joel Bedard,2019-08-29T18:48:18Z,That was awesome!,2
J B,2019-08-29T18:45:56Z,That was fucking awesome!,0
Terry Hudson,2019-08-29T18:39:55Z,"Honestly I really look forward to these videos, they've been brilliant!",40
Matt Kocian,2019-08-29T18:34:00Z,"~6:26, bong on the shelf below the painting?",2
William Cheek,2019-08-29T18:30:21Z,what are those shades Morton is wearing?,7
Bri C,2019-08-29T18:28:57Z,Been waiting weeks for this one!!,1
Massimo Caradonna,2019-08-29T18:22:52Z,Sick!!!,0
Dan Carroll,2019-08-29T18:18:37Z,I love that EF gets off the road and does these epic rides.  Great way to connect with everyday cyclists.  New favorite race team.,444
sportmanatg,2019-08-29T18:10:15Z,Thank you guys so much for making these!,3
dorant dh,2019-08-29T18:06:54Z,"Can some tell me, are they high or on a big amount on CBD (not that there is anything wrong with it), or that's only their personality?",5
Stanislav,2019-08-29T17:49:44Z,Liking the video before even watching it 👌🏼👌🏼👌🏼Would like to see more Rapha and EF on the MTB trails,34
Harry Dowdney,2019-08-29T17:34:46Z,First,2
