Earl Styles,2022-09-05T23:52:04Z,"Love how he reference ""Hard working MEN"" those are the ones that made Leadville what it is today..HARD WORK and no BS if you know what I mean....I do this race every year and permanently marked my body with Ink to signify what it means to me and the History behind it.....Make no mistake...behind every great hard working MAN, is the rock aka WIFE....",0
nickyburnell,2022-08-21T22:26:31Z,Like,0
Anthony Sears,2022-08-02T12:25:59Z,The racing is cool. The speeches are painful to listen to!,0
Anthony Sears,2022-08-02T12:18:59Z,Wait until current liberal admin. Gets done. Highest unemployment in the world!,0
I Mc,2022-05-19T22:39:09Z,"I did Leadville several years back, and I have to say, it was probably the best day I’d ever had on a bike. Riding bikes in an amazing place with hundreds and hundreds of other like minded people was absolutely amazing. I will always look fondly at my bucket for all the great memories from that day. If any of you are thinking about doing Leadville….DO IT!",0
Carlos Febles torres,2022-03-15T15:55:44Z,15:53 my man dropped the bottle and the woman behind him took the other bottle away from him,0
Sascha Mel,2022-03-10T12:25:19Z,21:16 is it Lance?,0
Brand Hark,2022-02-18T20:47:27Z,I love Lochlan.,0
Bo Sanders: Public Theology,2021-12-20T04:38:28Z,I have watched this several times since it was first posted. It gets better every time. Lachlan is just one of a kind.,0
David Dorr,2021-11-18T17:41:49Z,"""I was struggling as to what the purpose of being a professional bike rider was ... people reaching out and saying they were motivated to get back on their bikes ...""  That's me, Lachlan! thanks!",0
maconSTUFF,2021-10-31T16:30:59Z,"Great video and great story... I'm doing my first endurance event in like 5 weeks... a local race here in Namibia called the Desert Dash... 393km in 24hrs... pretty young event, but its starting to attract people from all over the world... wish me luck!",3
Gabrielmtbgopro,2021-06-28T19:25:35Z,Leadville used to b cool ! before lifetime f corporation,0
deppyboi,2021-05-13T07:58:26Z,Does anyone else skip forward every time Tyler speaks?,0
Riders of the Cody Scarp,2021-02-02T05:36:49Z,Great race!  Great Team!  Go Cannondale!,0
Boycott Factory Farms,2021-01-29T00:39:38Z,"Watched this 2x now. And after covid, we would be honored to chase the EF boys and support Leadville!",1
Joe BEECH,2021-01-26T09:53:55Z,Fantastic doco.  Really love the community spirit and fighting spirit of everyone.  Love it:),0
linglingjr,2021-01-26T05:34:26Z,It's all  fun and games doing events like these until Van der Poel and Wout Van Aert show up to dirty kanza or something like this...,0
occyman,2021-01-25T09:01:22Z,"I remember riding with Lochie (when he was a very young fella), his brother and his dad back here at Coluzzi in Sydney. Good on you Lochie...",0
labmatthew,2021-01-24T04:28:53Z,This is classic!  These guys are great!,0
Brett M,2021-01-13T13:09:06Z,Now I want Howe and Finney and Morton to come try the Marji Gesick 100 and see if they think it's harder than Leadville.    ;)      This vid was so awesome though...  so great to hear how hard it was even for the pro guys.   ""It doesn't get any easier you just get faster"".    To quote a douche.   lol...,0
Ray Laux,2021-01-12T01:00:49Z,"Leadville, boo hooo",0
Paul McClure,2021-01-07T04:52:50Z,"Thanks for the memories. I did it in 98, 99, 2000, & 2001 and it kicked my ass every time! Great race, well organized, great people, and beautiful country!",0
Philip Barrett,2021-01-03T18:14:17Z,Leadville; where walking to breakfast will leave you breathless!,0
Keith Moore,2020-12-31T12:56:58Z,Nothing like starting a race with a double barreled shotgun.,0
freddodu,2020-12-14T02:28:07Z,15:42 lol 😂,0
Kelly Mckenzie,2020-12-11T07:18:15Z,Definitely the most endearing bromance I've ever seen,2
GreyWolfClimber,2020-12-01T12:20:30Z,"It's a great atmosphere. I did this several times back in the 90s before it got trendy. Did the Vail Ultra 100 too when it started up a rivalry with Leadville. They'd be one week after the other. Vail is too polished for me. Didn't like staying there.I lived in California at the time, so trained a lot at high altitude in the Sierras, so I would arrive acclimatized, so it wasn't too bad. I did the race in 2000 after living in the UK for a while, and suffered badly. Had to visit the medical tent afterwards and breathe oxygen. And for the rest of the week, couldn't sleep properly because of being unable to catch a full breath.They are right about ""The Powerline"". It's not a road. It's just where power pylons go STRAIGHT up the mountain, so it's a 20% gradient dirt trail.The trail up to Columbine mine is not too bad for most of its length. Above the tree line it's only semi rideable upwards.",0
JMS,2020-11-27T13:28:10Z,"Holy shit! I keep watching these things and I just keep being surprised at how engaging and immersive they are, and that they actually have something to say.",0
Steven Holland,2020-11-11T05:24:56Z,"OMG STOP SAYING “ LIKE”, these three couldn’t talk if you took that word from them...",0
Christopher Farmer,2020-08-07T02:26:58Z,Anyone know the name of the song at the beginning? Was in the DK video as well.,0
Finn Atwood,2020-07-24T07:07:11Z,6:20 that’s a huge bong bro,0
Re Scavone,2020-07-22T21:52:59Z,These films are amazing. Watching how this race/ride galvanizes the cycling community gets my eyes pretty misty. This is the side of cycling that keeps people doing crazy things. I love seeing a pro tour team being involved with these things and closing the gap between the average joe and the pro. Keep making these films!! The cycling world needs more content like this!!,0
Luke Durkin,2020-07-15T06:32:51Z,"""If you show up to a rodeo with this on, people assume you know how to crush Bronc"" - best line I've ever heard from a pro cyclist.",9
Road Glide,2020-07-07T00:30:06Z,Less is always more. Peace.,0
Lenny Smoothmountain,2020-07-06T00:18:39Z,Anyone know where can I find Morton's inner bar ends??,0
Comments Enabled,2020-06-29T02:22:31Z,A lot of this seemed very slow.,0
Scott Sheridan,2020-06-21T01:13:06Z,"Did anyone count the number of times the word ""like"" was like, used in this video?",0
Brett Phillips,2020-06-19T00:41:42Z,"I'm not a big fan of Leadville, that town is fucking bleak. You shouldn't put a town above 10,000 feet, it's too barren",0
DR -,2020-06-17T14:28:22Z,"Arguably one of the most noteworthy performances here is hardly featured at all since the rider, Quinn Simmons  (finishing  @20:05),  was not one of the ""chosen” few for this video.  In fact he isn’t even mentioned by name despite finishing on the podium. Full story here: https://durangoherald.com/articles/289241 Short version: He rode with the leaders, lost contact (and much time) due to punctures from tacks on the course, chased back riding solo to take the sprint for second. An epic effort and result. And he was a junior! He also had another pretty good result on the road the following month: https://www.youtube.com/watch?v=hRAWul6Nd4IFun fact- the last American to win the junior world road championships was a fellow named Greg LeMond.",0
Gill da kind,2020-06-17T04:34:25Z,I work at the dump.a few months back I found a Louisville 100 under 30 hours   Belt buckle still have it where it all the time,0
Tex Judd,2020-06-03T04:05:20Z,I have watched this 5 times today... I can not get enough of the personalities. The cinematography and audio are phenomenal.. Thank you!,1
Tricia Mcintyre,2020-05-02T15:42:39Z,"Looks brutal,I would take my e-mtb with spare batteries and still not get to the finish 👍🚴",0
Don Gibson,2020-04-27T14:49:50Z,"Superb. Or rather, dammit, another one on the bucket list.",0
Exodus Velo,2020-04-23T02:21:06Z,I love this new gay friendly approach.,0
Phil R.,2020-04-22T00:28:08Z,Fuck. Rapha. You always make me want to ride bikes. Well done.,0
Bart Thompson,2020-04-21T23:05:40Z,"Man, I've seen the Dirty Kanza video and now this, and they are freakin' awesome. Amazing content and quality. In an age in which professional cycling seems so foreign and disconnected from the every day cyclist, this sort of content does a great job of connecting the professionals to everyday people, and frankly reminding all of us why it's just a lot of fun to go out and ride your bike. Keep it up Rapha/EF/etc.",0
Jacob DeAngelis,2020-04-21T02:38:30Z,One of the most well produced professional race documentaries I’ve seen. Awesome job love the alternative calendar.,1
Dean Johnson,2020-04-12T23:24:52Z,hmmm 2016 --- 17 seconds in looks familiar https://youtu.be/_3ZayzZpakc?t=17,0
Karlee Hall,2020-04-04T03:03:56Z,i live in leadville! the race is great and a great way to get economic growth in our community. the only thing i hate is when people park in front of my driveway.,7
ocripcurrent,2020-03-30T02:32:09Z,I kinda wanna punch Alex Howes in the face,0
Codem,2020-03-14T21:34:16Z,"Leadville is more than 3000 meters above sea level, that's honestly incredible",0
Jordyn A,2020-03-07T02:06:45Z,🔥🔥🔥🔥  🏁🏁🏁you have to look all the way🏎️🏎️🏎️  1:23 💓💗❤    👇 👇 👇 👇💟,0
L D,2020-03-01T06:00:39Z,These guys are just awesome for cycling. Three brilliant characters.,0
Simo429,2020-02-23T09:59:26Z,Albert Moreno?,0
Manuel Rabelo,2020-02-22T16:04:01Z,Are these guys high? lol,0
Wü Di,2020-02-17T10:58:23Z,"Hi, can u tell me the Name of the BarEnds Lachlan mounted on his flatbar?? cheers",0
Bon Gabs,2020-02-11T19:38:29Z,"Please Rapha,,keep on doing this kind of film,,the best",0
Matthias GUTHARDT,2020-01-31T20:55:45Z,Such a great video !,0
Franco Vai,2020-01-30T16:21:11Z,"Best intro ever, that voice was spot on! ""Keyword is, Leadville!""",3
Box Turtle,2020-01-24T19:25:39Z,"Oops, my bad.  I thought this was the famous footrace.",0
Thomas,2020-01-17T23:43:58Z,Quality video.,1
Andrew Graham,2020-01-15T23:30:26Z,Is that a bong on Alex' shelf?,0
T W,2020-01-07T13:07:06Z,"I love how EF ""B-Team"" shows up to these amateur events, for the WIN. Want to truly experience it?? DROP your ""pro"" status, all sponsorships, and get a day job - work 40-60hours! ;)",0
Denise Blalock,2019-12-29T08:28:52Z,"I have some advice for Leadville100 in 2020...........Have the downtown area roped off at the corner turn & supervised by police to keep lots of  cheaters from cutting in at the last minute after the start.  I personally watch this happen in 2019.  Not fair to cyclist who are in their correct corrals early before the start.  It matters when seconds count at the 40 mile marker before your sweepers disappoint riders who trained hard to get to that important marker by 10:30.  My son completed all his pre-course races in alotted time, so he could be disappointed at 40 mile marker by less than 1 minute during Leadville100. (His computer chip time was under 10:30) , yet his number was pulled.  There are TOO many riders bunched up trying to get into a rhythm the first 20 miles, which slows all cyclists down.   CHEATERS should be stopped.  Lots of money and time is invested in this race & I expect a professional race committee to oversee it.  You call yourself one of the best,  I say demonstrate it , instead of just talking about it.  YOU need to DIG DEEP and show all riders you really care.  MAJOR  MONEY is fed into your economy during the race series.  SIGNED by a MOM & 9th year CENTURY RIDER FROM TEXAS where temps are 108-113 at finish line.",0
Jason ML,2019-12-22T03:30:24Z,"It's a cool race in and of itself but most of the people who come here for it ablsoluley trash the town and treat the locals like shit. Not a fan. Leadville sees none of the money either. They boast about jobs, this is a very short event, theres less than 15 Lead role race series year round employees...",1
Jordan Apple,2019-12-13T00:21:55Z,"Leadville is doing much better now! Tourism has helped so much, the mine re-opened in 2012, too.",0
alan p,2019-12-11T03:55:43Z,love love love this video and lachlan morton is the f##$#CKING man,0
Alex Clark,2019-12-01T15:07:52Z,Does anyone know where I can find those   mini aero bars ? I've been searching for awhile with no luck,1
Dan Mathis,2019-11-14T11:17:54Z,"We love seeing EF expanding to these races!! Yes, you are The Pro team to follow!! Keep it going!!!",0
marnixxish,2019-11-11T19:48:47Z,"When they started talking about the run and the bike ride I thought they would at least mention becoming a lead(wo)man. It's insane. 10k run, trail run marathon, 50 mile trail run or MTB, 100 mile MTB and 100 mile trail run. All within like 2 months. https://www.leadvilleraceseries.com/leadmanleadwoman/",2
jlouis102000,2019-11-11T04:37:07Z,Lachlin and Alex are too cool.,0
De Cnijf Kris,2019-11-05T18:44:02Z,To be introduced in Belgian Ardennes and Hautes Fagnes. Interesting concept. Imagine passing those small Battle of the Bulge towns and people cheering.....  What I would do in Leadville is to let riders start in packs in order to avoid standstills. It will give a more dynamic dimension to the race.,0
JWB,2019-10-31T09:09:38Z,"Really excellent, this will inspire a lot of people - whew.  Watched it twice myself!  Thank you for your hard work (and dudes, wow, that was some seriously epic racing :)  way to ride!!!)",0
Andrew Crawford,2019-10-26T21:25:05Z,Lachlan Morton just may well be the most irritating rider in pro cycling,0
Andrew Baker,2019-10-23T23:50:04Z,Why 1x SUX - ""as soon as I was running I realized I was going faster..."" That is NOT how gearing is supposed to work. Gearing makes you faster in every riding situation than walking/running. 1X BLOWS. So happy to not have it.,0
Josh Zaring,2019-10-18T22:51:15Z,That intro..... chills up and down my spine. Excellent job.,0
Antonio Valone,2019-10-17T19:43:21Z,Phinney mumbling thru why he was quitting before the race even started...very foretelling of his retirement announcement at age 29,0
nayr497,2019-10-17T14:39:17Z,"""I've pushed through enough injuries in my career..."" Taylor Phinney. Jeez, such an understatement. A few feet either way, and maybe Taylor died hitting that guardrail. If the guy never wins, never even podiums again, just to come back and be racing at such a high level after that crash is truly amazing. Guys in Lycra might not seem as tough as contact sports dudes, but the  more you know about bike racing, the more you realize how hard as nails these folks are, going through what they do.Somebody sign him up for 2020 already! I want to see him in Paris-Roubaix again!",4
John Payne,2019-10-17T00:34:27Z,"Thanks Rapha and EF for putting forward another perspective, and I must admit, an excellent backing track. Thanks to the riders for sharing their thoughts and reactions. Real, earthy, muddy, and inspiring.",0
Gerald Powell,2019-10-12T01:09:40Z,Leadville,0
Gerald Powell,2019-10-12T01:08:52Z,I would love to do the Lewisville 100.,0
Lee Hayward Orbea Racing Team UK,2019-10-01T16:12:13Z,Dude you say ""like"" waaayyy too much,0
Miikka Suonio,2019-10-01T11:19:16Z,"Like everyone has mentioned, this is a great series. Inspiring, I really loved the film!",6
William Ward,2019-09-26T06:40:15Z,"Signed up for my first gravel race after watching these EF series! Borrowing a gravel bike for the event! No expectations, just looking forward to having fun and trying something new!",18
Nick Bulanda,2019-09-23T05:35:55Z,"Killing it with these videos, i am a fan now. Keep them coming!",0
owen Vermeulen,2019-09-21T15:18:05Z,It looks like Alex's wife should teach JV had to do a bottle handoff!!!,0
Mr Kickback,2019-09-19T22:35:30Z,What model bikes are these guys using?Great video BTW 👌,0
Sissy Rosebrock,2019-09-19T22:05:29Z,"Wish I had a dollar for every time they said ""like"" when it is unnecessary.  Otherwise, I enjoyed it!",0
James Fish,2019-09-19T13:22:07Z,Wait so is the entire race on fire roads? Is there any singletrack?,0
Nuno Bértolo,2019-09-18T22:34:04Z,"BOM TRABALHO, BRUTAL!!!!!!",0
B E Meloy,2019-09-18T20:50:19Z,"Love these three riders!!!! DK200, Leadville 100, you guys rock. Sorry to see that Taylor couldn’t do the race. Get better Taylor, hope to see you race again in the future. Keep up the good work EF on showcasing the non-traditional races!!!!",0
Alvaro Federico,2019-09-18T14:45:49Z,CyclingTips Van at 1:14,0
durianrider,2019-09-18T13:46:12Z,With a 30 on the front  LM would have won this. Less fatigue metabolites for sure! In a race at altitude and so long it gives the marginal gains. Hardtail as well. No need for DS on such a fast course. Grotts had the right bike choice. Lighest bike in the top 5 and rode away like it was. Great edit.,1
durianrider,2019-09-18T13:30:49Z,I thought Gaimon was the national champ wearing his stars and stripes in a UCI race he crashed himself out of?,3
walter mcdonough,2019-09-18T03:21:40Z,What were those glasses Lachlan had on?,0
Thomas Purdy,2019-09-15T02:56:07Z,Loving these Rapha Films - awesome work guys!,1
Phillip Lloyd,2019-09-14T23:57:09Z,Well Said at 03:43 Taylor - I never thought I'd say that :-),1
jlouis102000,2019-09-13T17:41:02Z,A really good video.,0
alan p,2019-09-13T12:02:16Z,huevos!!!,0
Ken Segel,2019-09-10T20:33:06Z,Kick Ass video!! Thanks for posting,0
MrHardPressed,2019-09-10T20:30:15Z,like...like...like...,0
Max Michelson,2019-09-10T09:09:49Z,Congratulations EF GOING OUTSIDE OF THE PRO peloton getting involved with every day cyclist . We all know about Leadville what history behind the town incredible many thanks for sharing this to the world,7
ArthurDentZaphodBeeb,2019-09-08T21:36:13Z,Drop the self-indulgent twaddle,0
Jamie Wiley,2019-09-08T17:50:36Z,I just can't wipe the smile off my face as I watch this. Just makes you want to ride,22
Angel Gutierrez,2019-09-08T16:01:59Z,Alex is an idiot!,0
Mathieu C Mehl,2019-09-08T11:28:16Z,But where can I find some of the side-view blinders Lachlan Morton has on his sunglasses?,0
MJLRacing,2019-09-07T02:35:11Z,so cool! great filming work and editing! You're team riders are so bad ass and bro style and inspirational!,0
Black Sheep MTB,2019-09-06T03:55:48Z,what's on lachlans bars beside his grips? are they old school bar ends?,0
ewofinwefoinwefqw,2019-09-05T21:12:09Z,Those dude are the best 💯,1
drewmartinezart,2019-09-05T14:49:36Z,"Like, um, like, yeah.",0
tomordr,2019-09-05T00:27:01Z,"So like, like, like, so yeah. Enjoyed the video. So like Thanks 🙂",0
Brent Gaul,2019-09-04T12:48:03Z,Taylor Phinney is a fool.,1
James Moore,2019-09-04T08:01:35Z,"Epic! well done lads fantastic work on the video, what a race, such a shame for Taylor",0
Phil Anderson,2019-09-04T04:17:34Z,"Huge props to Rapha for making these films. Great modern marketing, and just great story telling to share.",0
Myles Fitzgerald,2019-09-04T03:38:09Z,These guys seem stoned. How boring to listen to this nonsense. Burn some calories doing something useful rather than indulge your ego.,0
Colorado Classic,2019-09-04T01:03:51Z,We love seeing you guys competing in the dirt. Keep up the good work boys!,0
NonchalantGarage,2019-09-03T22:12:39Z,Absolutely the best EF video. Great production. I got chills,0
Jonathan Walters,2019-09-03T12:56:24Z,"Such beautiful made movies. You get the best out of the riders, the scenery and the events. Don't stop!",0
Walt Quandt,2019-09-03T03:59:52Z,Is it me or are pro riders the most laid back dudes on the planet... until they get on a bike!,0
Marc,2019-09-03T03:59:24Z,"Taylor is dancing over eggs, can’t he try the ride",0
Roosevelt Tejedor,2019-09-03T02:53:44Z,"Man, you guys knocked out of the park with this film. Love the vibe and emotion",0
Carl Gar,2019-09-02T21:52:11Z,WOW,0
nick fink,2019-09-02T21:46:08Z,These videos are WAY better than watching dull big team tactics nullify grand tours.,0
phil allan,2019-09-02T21:33:33Z,"Absolutely loved these films, Beautifully shot, great interviews with the EF guys and something beyond the trad road scene. Fabulous. And yes - inspiring. I've bought a mountain bike for the first time in 20 years!",0
Paul Blaik,2019-09-02T17:19:20Z,Loving these EF Ralpha Race films!,0
Jonathan Wait,2019-09-02T16:12:55Z,"Great cyclist, terrible talkers.",0
Stephen Ribero,2019-09-02T14:26:56Z,These guys interviews arent really inspiring me. Cool footage though.,0
jlouis102000,2019-09-02T11:38:44Z,I love this video.,0
Sebastian Kienle - Official,2019-09-02T05:30:55Z,"Shows that you can be valuable for sponsors without winning, shows that you don‘t have to win to inspire people, shows that winning isn’t always the most important thing.",1
Manny F,2019-09-02T03:04:48Z,These gone racing films are the best content Rapha has ever produced and this EF team is one thatll be remembered for years to come.,0
Rafael Malmegrin,2019-09-01T19:15:25Z,"Loved the video that race looks like the kind of ride I love to do. These Rapha videos made me a fan of the EF dudes, specially Lachlan what a beast.",0
thetalkingfly,2019-09-01T18:13:42Z,"Who in the crap does this videos??? They are so good!!! Sports journalism can be so lame!!!! haha these are fine art haha! so human and so beautiful! cheers, Steve aka The Talking Fly",75
Phillip Trzcinski,2019-09-01T17:20:39Z,"Loving this whole series of videos, Lachlan is fast becoming one of my favourite cyclists, such a great outlook and attitude. Keep it up.",1
Robert Johnston,2019-09-01T15:56:32Z,"Is it even possible to say the word 'like' more often than these guys !@£$%^!? I do not mean to be rude, but f**k me, learn how to get your point across without, you know, like, well, like, you know.... its like, like !@£$!",0
Jonah Conner,2019-09-01T15:27:13Z,If you've never exercised at that altitude there's no way to explain how shitty it feels.,0
Jonah Conner,2019-09-01T15:17:57Z,Lachlan looks like he could be Bob Dylan's son,1
Tom,2019-09-01T09:06:00Z,"These videos are so good, they are much more attainable to the average guy. You boys inspire me so much to get out there a push myself.",0
Steve King,2019-09-01T08:55:12Z,What a boring video,0
mr drifty,2019-09-01T08:20:35Z,This isn't a mountain bike race its a road bike race on dirt pretty lame,0
Willian. Direction,2019-09-01T08:06:18Z,EF does that stand for Education First . How about teaching these dudes to talk proper with out all the f n ""like"".,0
Two-eyed Roy,2019-09-01T06:27:02Z,"You can take the boy out of Port Macquarie, but you can't take Port Macquarie out of the boy. Rock on Lachy you shiny diamond.",0
drasztikus,2019-09-01T05:49:48Z,Epic as always.thanx,0
John Smith,2019-09-01T04:31:28Z,National anthem ruined it for me.,0
Matt Surch,2019-09-01T01:03:39Z,So good! This is the first thing I’ve ever seen that makes me want to race Leadville. Brilliant!,0
T-bone,2019-08-31T22:56:53Z,Another great video from you all! So great these roadies are riding different events respecting the format and the regular riders. So inspiring!,0
Jason Crawford,2019-08-31T20:26:52Z,EF and Rapha get content marketing right,0
Joel Henderson,2019-08-31T19:31:20Z,"Honest question: why is everyone on mountain bikes? This seems like a course where you'd use a gravel bike or similar with 42mm or 45mm tires and relatively low psi (low for non-mtb tires) to avoid any losses from suspension bobbing, not to mention saving weight.",0
Andrew Besold,2019-08-31T18:30:40Z,Way too much talking and way too little race footage. Almost had me giving it a thumbs down.,0
Joseph Karas,2019-08-31T16:43:30Z,So stoked to go ride today now 😁😁🙏,0
44stevenson,2019-08-31T14:50:17Z,"Is there any single track in this race.  Doesn't look like it from the video and if not, why not a gravel bike?",0
truehead1,2019-08-31T14:14:00Z,Best video i’ve watched in a while!,1
marc layne,2019-08-31T13:11:48Z,"i was in Outward Bound, Marble CO, 1973.......",0
Troy Collett,2019-08-31T13:02:43Z,Loving this alternate program from EF and certainly takes the riders out of their comfort zone,0
Daniel Journell,2019-08-31T10:48:57Z,These three dudes are likely the chilliest savages on the bike. They will rip your legs off and as they ride by hit you with a “wassup bra! Killer weather right bra!”  Love these dudes.,2
xgalvan1,2019-08-31T10:24:56Z,"This is legit better than watching any Tour de France stage win, then you link this to Tour of Utah stage win the next week - awesome connection that pro cycling is missing.",1
S J,2019-08-31T09:28:13Z,Well done film. Finished Leadville 100 MTB 4 times myself.  Agree with Phinney's comments about everyone doing it being crazy!  Love it though...and love the area.  Something raw about Leadville as compared to rest of Colorado.  Probably why I bought a cabin near the race course.,1
Walter Taylor,2019-08-31T09:22:26Z,I was ""like.""  Well it was ""like.""  Like I think these interviewees say too many ""likes."",0
Patrick Blair,2019-08-31T07:37:18Z,these videos are so good!,0
Jasa Dona,2019-08-31T06:35:04Z,What a video! Just wanna ride now.....awesome,0
Harald Schreiber,2019-08-31T05:39:14Z,EF alternative race progam rules! Keep it on!,0
Mr. Anderson,2019-08-31T05:02:40Z,Nice piece on the top shelf.,0
Preston Thomas,2019-08-31T04:42:18Z,I wish I was emo,0
AskDrKing,2019-08-31T03:53:09Z,Great video!  You guys captured the ""feel"" of Leadville.,0
TheoreticallyNo,2019-08-31T03:24:37Z,Loving these stories.,0
Phil Nigash,2019-08-31T03:18:38Z,"To whoever edited this piece - A+ all the way. Timing was impeccable and you really told a fantastic story, complete with suspense. Every one of these episodes just get better and better. Don’t stop crafting these mini docs!",0
Sven G,2019-08-31T03:16:06Z,Awesome,0
Kazimir Smith,2019-08-31T03:07:17Z,thanks for this rapha and ef - these films are so great and i hope there's loads more to come in the future ...,0
Lucas Trottier,2019-08-31T02:17:38Z,Anybody knowa the name of the song in these amazing EF gone racing vids? I desperatly need this in my life!,0
